<!ELEMENT site (site_id, site_name, region, habitat_type, export_date, sightings)>
<!ELEMENT site_id (#PCDATA)>
<!ELEMENT site_name (#PCDATA)>
<!ELEMENT region (#PCDATA)>
<!ELEMENT habitat_type (#PCDATA)>
<!ELEMENT export_date (#PCDATA)>
<!ELEMENT sightings (sighting+)>
<!ELEMENT sighting (species_name, species_category, is_priority, count, date, observer, weather_conditions, notes, photo_submitted)>
<!ATTLIST sighting id ID #REQUIRED>
<!ELEMENT species_name (#PCDATA)>
<!ELEMENT species_category (#PCDATA)>
<!ELEMENT is_priority (#PCDATA)>
<!ELEMENT count (#PCDATA)>
<!ELEMENT date (#PCDATA)>
<!ELEMENT observer (#PCDATA)>
<!ELEMENT weather_conditions (#PCDATA)>
<!ELEMENT notes (#PCDATA)>
<!ELEMENT photo_submitted (#PCDATA)>